{
  "$schema": "../../schemas/jx-v5-solar-1pn-q2-observer-registration-v1.schema.json",
  "schema": "jx-v5-solar-1pn-q2-observer-registration/v1",
  "registration_id": "jx.v5.solar_1pn.q2_observer_registration.v1",
  "qualification_id": "jx.v5.solar_1pn.qualification.78d05102bac2588b7677ec5ef19c653c0102923a1ab499852194f423c8911781",
  "status": "AWAITING_EXTERNAL_Q2_OBSERVER_REGISTRATION",
  "design_only": true,
  "outcomes_generated": false,
  "execution_authorized": false,
  "registry_authorized": false,
  "evidence_class": "MODEL_OUTPUT",
  "protocol_constants": {
    "event_function": "R_DOT_V_ZERO_OUTWARD_PERIHELION",
    "event_direction": "NEGATIVE_TO_POSITIVE",
    "observer_class": "INDEPENDENT_ARBITRARY_PRECISION",
    "angle_class": "HIGH_PRECISION_ORIENTED_ATAN2",
    "binary_float_trigonometry_allowed": false,
    "linear_event_interpolation_allowed": false,
    "paired_force_execution_required": true,
    "step_grid": ["0.04", "0.02", "0.01"],
    "event_tolerance_grid": [
      "0.00000000000000000001",
      "0.000000000000000000000000000001"
    ],
    "eccentricity_roster": ["0.31", "0.47"],
    "orbit_count": 2,
    "analytic_leading_coefficient": "6*pi",
    "scaling_parameter_kind": "INVERSE_C_SQUARED"
  },
  "observer_rules": {
    "initial_event_exclusion_rule": {"status": "AWAITING_EXTERNAL_RULE", "value": null},
    "event_bracket_acceptance_rule": {"status": "AWAITING_EXTERNAL_RULE", "value": null},
    "root_method_id": {"status": "AWAITING_EXTERNAL_METHOD_ID", "value": null},
    "root_termination_rule": {"status": "AWAITING_EXTERNAL_RULE", "value": null},
    "orbital_orientation_rule": {"status": "AWAITING_EXTERNAL_RULE", "value": null},
    "angle_unwrap_rule": {"status": "AWAITING_EXTERNAL_RULE", "value": null},
    "orbit_index_rule": {"status": "AWAITING_EXTERNAL_RULE", "value": null},
    "secular_regression_rule": {"status": "AWAITING_EXTERNAL_RULE", "value": null},
    "step_extrapolation_rule": {"status": "AWAITING_EXTERNAL_RULE", "value": null},
    "event_extrapolation_rule": {"status": "AWAITING_EXTERNAL_RULE", "value": null},
    "inverse_c_squared_extrapolation_rule": {"status": "AWAITING_EXTERNAL_RULE", "value": null},
    "analytic_target_expression": {"status": "AWAITING_EXTERNAL_EXPRESSION", "value": null},
    "high_precision_pi_rule": {"status": "AWAITING_EXTERNAL_RULE", "value": null}
  },
  "external_bindings": {
    "observer_source_binding": {"status": "AWAITING_EXTERNAL_SOURCE", "value": null},
    "observer_runtime_binding": {"status": "AWAITING_EXTERNAL_RUNTIME", "value": null},
    "observer_configuration_binding": {"status": "AWAITING_EXTERNAL_CONFIGURATION", "value": null},
    "observer_independence_binding": {"status": "AWAITING_EXTERNAL_INDEPENDENCE_ATTESTATION", "value": null},
    "sealed_expectation_binding": {"status": "AWAITING_EXTERNAL_SEALED_EXPECTATION", "value": null},
    "q2_budget_binding": {"status": "AWAITING_EXTERNAL_BUDGET", "value": null}
  },
  "ready": false,
  "nonclaim": "This null registration supplies no observer, runtime, rule completion, expectation, budget, result, or execution authority."
}
